{
  "contract": "earworm/representation-record/v1",
  "record_ref": "fixture:record:original-return",
  "operation_ref": "fixture:operation:original-return",
  "representations": [
    {
      "contract": "earworm/representation/v1",
      "representation_id": "fixture:source",
      "subject_ref": "fixture:subject:fixture:source",
      "form": "text",
      "media_type": "text/plain",
      "encoding": "utf-8",
      "origin": {
        "kind": "authored",
        "domain": "non_acoustic",
        "source_refs": []
      },
      "source_class": "authored_work",
      "artifact": {
        "state": "retained",
        "ref": "fixture:fixture:source",
        "sha256": "743253a60ed0b8562bbf60a553941ff4988c6827852adb2a2b99484ba630f84e",
        "byte_count": 42,
        "inline_text": "hum\n\nhum, again.\nNo sound was played. \u2736\n"
      },
      "preservation": {
        "layout": "preserved",
        "losses": []
      },
      "convention": {
        "status": "not_applicable"
      },
      "time_basis": [
        {
          "kind": "sequence",
          "unit": "unicode_codepoint"
        }
      ],
      "terms": {
        "status": "declared",
        "ref": "fixture:terms:repository-license"
      }
    }
  ],
  "accesses": [
    {
      "contract": "earworm/representation-access/v1",
      "access_id": "fixture:access:original-return",
      "operation_ref": "fixture:operation:original-return",
      "representation_ref": "fixture:source",
      "role": "subject",
      "status": "available",
      "received_representation_ref": "fixture:source",
      "coverage": {
        "kind": "full",
        "unit": "byte",
        "ranges": [],
        "omissions": []
      }
    }
  ],
  "relations": [],
  "outputs": [],
  "binding_refs": [],
  "outcome": {
    "status": "pending",
    "recorded_by": "fixture-author",
    "reason": "Synthetic contract conformance example; no model or listening runtime was invoked."
  },
  "return": {
    "previous_operation_ref": "fixture:operation:sound",
    "representation_ref": "fixture:source",
    "kind": "original",
    "context_basis": "independent",
    "context_access_refs": []
  }
}
